{
  "schemaVersion": 1,
  "projectName": "ReferencesProject",
  "primaryDocument": "Book1",
  "documents": {
    "Book1": {
      "kind": "excel",
      "sourcePath": "src/Book1",
      "templatePath": "src/Book1/Book1.xlsm",
      "binPath": "bin/Book1.xlsm",
      "publishPath": "publish/Book1.xlsm",
      "commonModules": [],
      "references": [
        {
          "name": "Microsoft Scripting Runtime"
        },
        {
          "name": "OLE Automation"
        }
      ]
    }
  }
}
