{
  "schemaVersion": 1,
  "projectName": "DocumentSourceSetProject",
  "primaryDocument": "Book1",
  "documents": {
    "Book1": {
      "kind": "excel",
      "sourcePath": "src/Book1",
      "templatePath": "src/Book1/Book1.xlsm",
      "binPath": "bin/Book1.xlsm",
      "publishPath": "publish/Book1.xlsm",
      "commonModules": [
        {
          "name": "LibArray",
          "moduleFile": "LibArray.bas",
          "requested": true,
          "testOnly": false,
          "orphaned": false
        },
        {
          "name": "LibString",
          "moduleFile": "LibString.bas",
          "requested": false,
          "testOnly": false,
          "orphaned": false
        }
      ],
      "references": []
    }
  }
}
