{
  "schemaVersion": 1,
  "projectName": "MultiDocumentProject",
  "primaryDocument": "Book1",
  "documents": {
    "Book1": {
      "kind": "excel",
      "sourcePath": "src/Book1",
      "templatePath": "src/Book1/Book1.xlsm",
      "binPath": "bin/Book1.xlsm",
      "publishPath": "publish/Book1.xlsm",
      "commonModules": [],
      "references": []
    },
    "SecondBook": {
      "kind": "excel",
      "sourcePath": "src/SecondBook",
      "templatePath": "src/SecondBook/SecondBook.xlsm",
      "binPath": "bin/SecondBook.xlsm",
      "publishPath": "publish/SecondBook.xlsm",
      "commonModules": [],
      "references": [
        {
          "name": "Microsoft Scripting Runtime",
          "requested": true
        }
      ]
    }
  }
}
