{
  "schemaVersion": 1,
  "projectName": "PrimaryDocumentProject",
  "primaryDocument": "Book1",
  "documents": {
    "Book1": {
      "kind": "excel",
      "sourcePath": "src/Book1",
      "templatePath": "src/Book1/Book1.xlsm",
      "binPath": "bin/Book1.xlsm",
      "publishPath": "publish/Book1.xlsm",
      "commonModules": [],
      "references": []
    }
  },
  "commonModulesRepository": "../common_modules_repo",
  "commandDefaults": {
    "test": {
      "format": "text",
      "executionTimeoutSeconds": 240
    },
    "excelAutomation": {
      "workbookOpenTimeoutSeconds": 120,
      "workbookSaveTimeoutSeconds": 180
    }
  }
}
